SL NO,Image_ID,Caption
45,20240910005837_1,"A weathered boat sits atop a broken tree trunk by a calm river, surrounded by lush greenery in daylight."
46,20240902205041_1,"A character with long hair and a beard leans against a stone wall, sunlight filtering through a nearby metal railing, with ferns sprouting from the cracks."
47,20240902205244_1,"A bald man with a beard stands by a stone wall. Sunlight shines through a metal railing above, and ferns grow from cracks in the wall."
48,20240902210007_1,"A character holds a white paper with a drawing of a nude female character above a railway track, with a map displayed in the bottom left corner."
49,20240902213912_1,"A bearded man drinks by firelight near an old house, surrounded by supplies and dark trees at night."
50,20240909201146_1,"A bell hangs from a pole as sunlight streams through the trees in a misty, swampy forest."
51,20240909204044_1,"A dimly lit mansion foyer with twin staircases, marble columns, and a central chandelier."
52,20240909211520_1,"A rugged, bearded character in a coat sits beside a female character in a checkered dress."
53,20240909211754_1,"A rugged, bearded character in a coat sits in front, while a female character in a checkered dress sits behind him on a street in front of a building."
54,20240909212143_1,"A male character places his hands on a brick wall, standing in front of a female character at the corner of a building."
55,20240909213822_1,A male character with a beard wearing a jacket and a female character in a checkered dress sit side by side on chairs in a dark room.
56,20240909213905_1,"In a dark room, a female performer performs with fire on stage while the audience watches, sitting in their chairs."
57,20240909214347_1,"In a dark room, four female performers and a male performer perform on stage while the audience watches, sitting in their chairs."
58,20240820224138_1,A male character with long hair and a beard holds a cigarette in his mouth and a match with fire in his hand.
59,20240820224303_1,A male character with long hair and a beard smokes a cigarette while standing in a forest at night.
60,20240820224657_1,"A male character fires a revolver, the muzzle flash illuminating the darkness around him."
61,20240820225058_1,"A male character fires a revolver upward at night, the muzzle flash illuminating his figure and the surrounding forest."
62,20240823232630_1,"A male character stands by a calm river with a rifle, a horse nearby, and hills in the background."
63,20240823234109_1,A male character on horseback holding a lantern amidst falling snow in a dark forest on a snowy night.
64,20240823235905_1,"A male character firing a mounted machine gun inside a rustic barn, with sunlight streaming through the wooden walls."
65,20240827164745_1,"A male character wearing a raccoon hat and bandolier, standing in a sunlit forest."
66,20240827183135_1,"A male character and a female character in period clothing, one wearing a hat and the other with a bandolier, are seated on a horse-drawn carriage."
67,20240902175457_1,A male character in fox headgear holds two revolvers inside a dark room.
68,20240902191727_1,"A male character in a rugged leather coat paddles a wooden canoe across a calm, forest-lined river under a dim, cloudy sky."
69,20240718230256_1,"Meadow with wildflowers and greenery, adjacent to a pond. Clear blue sky above, surrounded by trees and chirping birds."
70,20240719152409_1,"A man in a leather coat holds a lantern on a sandy riverside at night, with a figure mid-air and a starry sky above the trees."
71,20240719154033_1,"Two male characters stand on a dock in the rain, overlooking a lake with a rainbow."
72,20240719162132_1,"A male character with a rifle sits on a horse, gazing at the night sky filled with stars above a forest."
73,20240720154058_1,"Two male characters, one with long hair and the other wearing a cowboy hat, sit on a vehicle in front of the Bank of Rhodes during the daytime."
74,20240720161216_1,A rider on horseback moves through a forest as sunlight streams through the trees.
75,20240720162054_1,A male character points a rifle toward another character in a tense standoff in a forest at night.
76,20240720172747_1,A male character with long hair stands before a fiery blaze in a dim underground tunnel.
77,20240630191144_1,"At sunset, a rally car races down a wet road, its headlights flashing brightly."
78,20240630191355_1," A rally car speeds along a wet road at night, headlights and taillights glowing in the dimly lit surroundings."
79,20240630191637_1,"A bell hangs from a pole as sunlight streams through the trees in a misty, swampy forest."
80,20240618214440_1,.A car on a lift at a repair station with automated laser systems performing multiple repairs.
81,20240602160709_1.jpg,"Street scene with neon signs, advertisements, and market stalls in a futuristic city."
82,20240602160837_1.jpg,"A Street View with stalls, buildings, and a vendor wearing a vest working in a food stall"
83,20240602214148_1.jpg,"Street scene with cars, buildings, lanterns, signs, and a large lion poster"
84,20240602221849_1.jpg,"A Character lies face down, legs detached, one hand remaining, with injuries visible on the body"
85,20240602223614_1.jpg,"A male character firing gun while falling backward, neon lights in background."
86,20240602224443_1.jpg,A Black car driving in mid-air on the road with pipes in an industrial background.
87,20240602224735_1.jpg,"A Person shooting gun at another person in a dark, industrial setting."
88,20240602224937_1.jpg,"Person firing shotgun, wearing red vest, standing in industrial setting with sparks flying."
89,20240602230231_1.jpg,A Car driving on city street at night with headlights on.
90,20240602230835_1.jpg,"A Person holding gun, another person covering lower body, vending machines behind."
91,20240602232917_1.jpg,Person standing in front of neon-lit bar with smoke and colorful signs
92,20240602233252_1.jpg,"A Female character with nose ring, blue hair, purple fur coat, and neon-lit futuristic background."
93,20240603145616_1.jpg,A Female character with tattoos and green-pink highlighted hair.
94,20240603160505_1.jpg,A Person shooting gun at cyborg in dark industrial setting.
95,20240603161222_1.jpg,Man shoots flamethrower at a cyborg's half body lying on the floor.
96,20240611131647_1.jpg,Character holding a cigarette in a neon-lit room with others in the background.
97,20240611131702_1.jpg,"Futuristic room with neon lights, multiple people, police tape, and a map on screen."
98,20240611134338_1.jpg,"Bloodied body with tattoos, detached legs, one hand on the ground, blood scattered"
99,20240618212350_1.jpg,A cyborg character in a white jacket with a robotic neck and hands sitting at a diner table.
100,20240618213042_1.jpg,A person with a cybernetic arm lounging in a diner booth with a leg on the table.
101,20240618214440_1.jpg,Car suspended in futuristic workshop with red lasers and flying sparks.
102,20240630193610_1.jpg,"Orange sports car driving on highway, speedometer showing 431 km/h."
103,20240701191145_1.jpg,Blue sports car on large rock in desert landscape with cloudy sky.
104,20240701191316_1.jpg,"A green sports car with scratches, shattered glass, and ripples, racing through a desert."
105,20240701191709_1.jpg,Green sports car and blue sports car flying over desert landscape.
106,20240701191826_1.jpg,"A green sports car with black shade and rippling effect, and a blue sports car on rocky terrain."
107,20240701192057_1.jpg,"Green and black sports car drifting on dirt, dust clouds, tire marks."
108,20240701192415_1.jpg,"Green sports car with black design and blue sports car, both on a desert road."
109,20240704213916_1.jpg,Dusty car on rocky terrain near lava flow with rising smoke
110,20240704213957_1.jpg,Lava flows in a volcanic crater with smoke and rocky terrain in the foreground.
111,20240704214019_1.jpg,"Lava lake with rocky shore, steam, and mountains under cloudy sky."
112,20240704214209_1.jpg,Two off-road buggies driving through a rocky desert landscape with mountains.
113,20240706104927_1.jpg,"Dark violet sports car in front of pink house, surrounded by cacti and desert plants"
114,20240706104958_1.jpg,Purple sports car with large rear wing parked on a desert road.
115,20240706113940_1.jpg,"Blue sports car driving on highway under power lines, clear sky."""
116,20240911025542_1.jpg,"A person carrying a rifle and shotgun walks through a dense forest, sunlight streaming through the canopy."
117,20241001215445_1.jpg,"Blue and orange bird stands on rock in forest, surrounded by greenery."
118,20241001215629_1.jpg,"Colorful parrots flying over rocks in dense, dark forest."
119,20241001215741_1.jpg,"A waterfall cascades over rocks in a misty forest, with a person standing nearby"
120,20241001220131_1.jpg,"Two men holding torches, walking in a dark cave with rocky walls"
121,20241001222102_1.jpg,"Explosion near rocky cliff at sunset, debris and people flying."
122,20241001224932_1.jpg,"Sunset over dense forest, green trees, cloudy sky, distant hills."
123,20241001231133_1.jpg,"Hot air balloon over grassy field, trees, bridge, sunlight through clouds."
124,20241001231208_1.jpg,Person in yellow coat stands on grassy area near bridge.
125,20241001231318_1.jpg,Hot air balloon over misty forest at sunrise with two people in the basket.
126,20240601214239_1.jpg,"A person in a light-colored uniform with blue accents, wearing an locket, standing in a sci-fi setting."
127,20240601214249_1.jpg,"A person stands in front of a window, looking out at Earth from space."
128,20240601214255_1.jpg,A person raising a hand from the spaceship.
129,20240601214259_1.jpg,"A person seen from behind, reaching out towards a view of Earth from space."
130,20240601214312_1.jpg,A hand holds a pendant with a beetle design. A small metallic device is attached to the wrist.
131,20240601214532_1.jpg,"A female character is sitting in a red box on the right side , with UI and UX credits displayed on the left of the screen"
132,20240601214539_1.jpg,A female character is sitting on the right side with encounter and level designers' names displayed on the left side of the screen.
133,20240601221425_1.jpg,"A character customization screen in a video game. The character, named V, has long hair, earrings, and star tattoos on the neck."
134,20240601224607_1.jpg,"A dark urban street with neon signs, advertisements, and a car driving."
135,20240601225353_1.jpg,"A cardboard sign rests beside a graffiti wall, with cans, bottles, and litter scattered on the ground."
136,20240601225419_1.jpg,"A man crouches near a graffiti wall, neon signs, and urban buildings in a vibrant setting."
137,20240601230500_1.jpg,A female character in a bathtub with holographic medical display and shattered glass around
138,20240601230618_1.jpg,"A cyberpunk cityscape features neon lights, a glowing billboard, and a futuristic building."
139,20240601230622_1.jpg,A futuristic hovercraft lands in a neon-lit city street surrounded by buildings.
140,20240602153711_1.jpg,"A rainy city street glows with neon signs, bright billboards, a police car, and pedestrians."
141,20240602153724_1.jpg,"A rainy cyberpunk street with neon lights, wet surfaces, stalls, and modern buildings."
142,20240602153818_1.jpg,"Rainy night viewed from vehicle, hovering aircraft shines spotlights on person near car."
143,20240602154054_1.jpg,"Driver holding steering wheel, dashboard with controls, advertisement outside, illuminated road, night view."
144,20240602154456_1.jpg,A man stands near a barrel fire in a dimly lit futuristic hallway.
145,20240602160636_1.jpg,A man with cybernetic implants eats at a street stall under neon lights.
146,20240706201924_1.jpg,"A yellow SUV drives through shallow water near trees, mountains, and a bright sky."
147,20240706235134_1.jpg,A floating platform with a tractor and two figures above a forested landscape.
148,20240707233049_1.jpg,"A black car crossing a shallow river surrounded by trees, hills, and a bridge."
149,20240707233249_1.jpg,"A black car is partially submerged in a cascading waterfall, surrounded by lush greenery"
150,20240707233449_1.jpg,A large waterfall cascades through a green forest landscape with distant mountains under clouds.
151,20240707233647_1.jpg,"A black rally car speeds across shallow water, leaving a trail, with a waterfall behind."
152,20240720120907_1.jpg,"A sleek, purple sports car with red rims and a large rear wing in a studio."
153,20240722200912_1.jpg,A purple sports car collides with a vintage yellow taxi in a desert landscape.
154,20240802220927_1.jpg,"A purple sports car speeds on a highway, showing 488 km/h and a skill chain bonus."
155,20240802223113_1.jpg,A sleek black sports car with reflective details is parked inside a modern showroom.
156,20240802223842_1.jpg,A black sports car with reflective paint drives on a desert highway under clear skies.
157,20240809211536_1.jpg,"An off-road vehicle drives through a shallow river, creating splashes, with trees and mountains nearby."
158,20240811220921_1.jpg,A colorful off-road vehicle speeds through a field of orange flowers with distant hills.
159,20241018160135_1.jpg,A character with a gun aims at another person inside a tented camp under cloudy skies.
160,20241018163944_1.jpg,"A horse-mounted figure is struck by gunfire, with visible impact and blood spray."
161,20241018163946_1.jpg,"A mounted figure slumps on a horse, showing visible gunshot wounds and blood spray."
162,20241018165344_1.jpg,"A kneeling figure bleeds on a wooden dock, with gunfire visible in the background."
163,20241018165346_1.jpg,"A rugged man aims a revolver, wearing a fur-trimmed coat and bandolier, outdoors."
164,20241018170135_1.jpg,A lone rider on horseback moves through a misty forest bathed in sunlight.
165,20241018172122_1.jpg,A deer with large antlers stands in a grassy field at sunset.
166,20241018172143_1.jpg,A large rocky cliff overlooks a foggy forest with soft light.
167,20241020160530_1.jpg,"A windmill stands against a sunset sky, overlooking trees and distant hills."
168,20241020163150_1.jpg,A rider on horseback traverses a field of purple flowers with mountains and cabins nearby.
169,20241020164421_1.jpg,A man in dark clothing violently attacks another man on the ground with blood splattering.
170,20241020164453_1.jpg,A bearded man in dark clothing appears to be striking another person.
171,20241020171324_1.jpg,"A man lies on the ground, injured, as another points a flaming weapon."
172,20241020171736_1.jpg,"A bearded man fires two revolvers, with flames bursting from the barrels."
173,20241020171934_1.jpg,"A scenic rural farmstead with fenced enclosures, barns, and a windmill foreground."
174,20241020174925_1.jpg,"A man riding a saddled horse crossing shallow water, surrounded by trees."
175,20241020175041_1.jpg,"A man slumped over in a wooden wagon, pierced with multiple arrows."
176,20241020180536_1.jpg,"A bearded man in a hat holds a lantern, riding a horse at night."
177,20241020190322_1.jpg,A man gets shot in the head with an arrow as two others aim rifles nearby.
178,20241020193031_1.jpg,Three figures stand before a partially constructed wooden building under a dark sky.
179,20241020193054_1.jpg,A man on a roof holds a plank as another supports it below.
180,20241020193103_1.jpg,"A partially built wooden house with a nearby campfire, people, wagon, and forest background."
181,20241020193322_1.jpg,A wooden cabin porch at night with a hanging bull skull and lanterns glowing.
182,20241020193409_1.jpg,A man and a horse are standing in front of a wooden cabin with a porch.
183,20241020193608_1.jpg,A bird is flying near a wooden cabin and campsite.
184,20241020202513_1.jpg,Two figures hanging from ropes in a misty forest surrounded by rocks.
185,20241020202905_1.jpg,A wooden house with a chimney surrounded by trees and open grassy fields.
186,20241020203058_1.jpg,"A wooden cabin stands in a dry, grassy field with a covered wagon nearby."
187,20241020203214_1.jpg,Three people stand outside a wooden house with a wagon in the background.