id,images,captions
1,20250608231339_1,"Two men confront each other outdoors at night, with fire visible behind them."
1,20250608231348_1,A man in a suit raises his arms as another man approaches outside at night.
1,20250614185928_1,Armed person in store approaches cashier and customer during an apparent robbery.
1,20250614190017_1,Man in dark suit walks down city street with tall buildings and helicopter overhead.
1,20250819195749_1,An orange cat and a black cat sit together near leafy pipes in a dim room.
1,20250819200355_1,"Orange cat and black cat explore a damp, overgrown area by mossy pipes."
1,20250819221128_1,A character in a bright robe and hat floats on a raft in a pipe-filled tunnel.
1,20250819223841_1,A black cat stands before a surreal wall with giant orange eyes and organic shapes.
1,20250819224128_1,A cat with a device walks through a wet pipe tunnel toward a robot standing in doorway light.
1,20250819224233_1,"A robot with green glowing eyes displays dialogue saying ""Was it? It was. Me. I was the scientist."""
1,20250819224416_1,Colorful Asian lanterns hang above stacked monitors displaying ornate decorations.
1,20250819235833_1,A robot with glowing blue eyes sits in a red hooded robe.
1,20250820144320_1,An orange cat sits on a mossy ledge surrounded by green plants and flowers.
1,20250518135442_1,A man with a gas mask holds a fire extinguisher beside another seated man.
1,20250518135508_1,A man in a red shirt pours water onto a bound man lying on the ground.
1,20250518140032_1,A sniper scope targets three people on a balcony; the crosshairs center on one individual.
1,20250518145248_1,"A fiery explosion bursts atop a forested hill, sending flames and smoke skyward."
1,20250523170957_1,A man sits while a topless woman stands beside him in a dimly lit.
1,20250523174936_1,A black pickup drives a rainy highway as lightning strikes above the ocean.
1,20250602232522_1,A soldier crouches firing at a fire hydrant on an urban street corner.
1,20250603002744_1,A yellow locomotive approaches on railroad tracks amid power lines and wind turbines.
1,20250603020502_1,A red and white helicopter flies above dark ocean water with an airplane visible ahead.
1,20250604011624_1,Two topless women with contrasting hair colors stand close together in a dimly lit club.
1,20250605145913_1,A man in a dark green jacket looks directly at the camera with the moon visible behind him.
1,20250606005617_1,A dark SUV sits on a street as a fiery explosion burns near buildings and palm trees.
1,20250606013546_1,A man in glasses and plaid shirt exits an office carrying a red fuel can.
1,20250606014750_1,A massive explosion engulfs the upper floors of an office building.
1,20250606014751_1,A fiery explosion erupts from the top floors of a multi-story office building.
1,20250606020747_1,Armed men surround two negotiators on a rooftop while SWAT officers aim from behind.
1,20250606020813_1,Armed agents aim at each other during a tense rooftop standoff at dusk.
1,20250606113611_1,A Mediterranean-style villa with a swimming pool surrounded by palm trees and lush landscaping.
1,20250608011703_1,A bruised man with tape over his mouth sits in a car.
1,20250608225428_1,Two men stand on a rural dirt road at night with mountains and city lights behind.
1,20250608225935_1,A man with a bloody nose talks on a phone at night.
1,20250608231221_1,A red off-road vehicle drives toward an industrial area at night with smoke rising.
1,20250614185938_1,A man in sunglasses and a pink shirt looks out at a sunset through blinds.
1,20250819200636_1,A small orange cat walks carefully along a narrow metal pipe outdoors.
1,20250819200642_1,"Three small cats, one black and two orange, curiously peer over a mossy ledge."
1,20250819200645_1,"An orange cat clings to a mossy pipe, looking down with wide eyes."
1,20250819200648_1,"A dark, foggy scene shows a mossy pipe with faint water in the background."
1,20250819201147_1,"An orange cat sits outside a shop window displaying ""FOLLOW ME"" with cat icons."
1,20250819201704_1,The image shows a dimly lit alley filled with glowing-eyed pumpkin-like figures and debris.
1,20250819203038_1,A small hovering robot labeled B12 glows beside an orange cat in darkness.
1,20250819220955_1,"Two robot figures, one with a glowing green face, talk in a dimly-lit room."
1,20250819223926_1,A small broken robot with red accents lies on a metal grate floor.
1,20250819225738_1,"A close-up of a cat hissing with mouth open, fangs bared, neon-lit."
1,20250819234405_1,A cat wearing a harness looks out through textured glass at neon-lit plants.
1,20250820144132_1,A figure in yellow clothing and a white cap with a blue visor walks among mechanical structures.
1,20250601134120_1,A man in a maroon polo stands in a kitchen holding a blue cup.
1,20250603015508_1,A large truck carries two cars on a nighttime highway curve with game interface showing money.
1,20250605143131_1,A woman climbs out of a van’s rear as a man faces her.
1,20250605144357_1,A man in a suit sits on a sofa as another man enters.
1,20250605145924_1,"A man peers into a grave, revealing a decayed corpse inside a broken coffin."
1,20250606002132_1,"Two men stand in a slaughterhouse room, facing a person hanging upside down."
1,20250606002713_1,A man in a red jumpsuit stands in an industrial facility with warning signs.
1,20250606020506_1,A nighttime office complex features a floating red and black cube sculpture surrounded by palm trees.
1,20250606020936_1,A tilted helicopter cockpit view approaches a modern campus with walkways and buildings.
1,20250607221653_1,A man in a suit stands under a jet wing inside an airport hangar.
1,20250607222745_1,A person in a suit holds a bottle out of a sunroof on a black limousine.
1,20250608011701_1,"Three men stand around a car trunk holding a bound, gagged shirtless man."
1,20250608011829_1,A bruised man in a bloodstained white shirt stares intensely outdoors at dusk.
1,20250608012927_1,A woman in leopard print stands in a kitchen as a man hugs her waist.
1,20250608012934_1,A woman with red spiky hair in a leopard print dress stands in a kitchen.
1,20250608225800_1,A man lies on a metal platform holding a pistol while another confronts him.
1,20250608230934_1,A man looks at a white car and red truck at dusk.
1,20250608231227_1,A small blue car with headlights on drifts near power lines under a night sky.
1,20250608231229_1,A blue car has collided with a red tow truck near an orange tanker.
1,20250614185958_1,"Two people sit at a table covered with blueprints, documents, and coffee cups."
1,20250614190018_1,A man in a floral shirt walks down a neon-lit city street at night.
1,20250819195744_1,An orange cat and a black cat lie together on mossy ground under leafy plants.
1,20250819200025_1,Three cats sit in a mossy stone archway with vegetation and old walls.
1,20250819200439_1,An orange cat runs through lush vegetation toward other animals in a misty forest.
1,20250819203616_1,Narrow neon-lit alley with a cat facing a humanoid figure with a screen head.
1,20250819203726_1,A cat with a device sits facing a robot in a cloak near a closed gate.
1,20250819211747_1,A metal lift platform with green lights stands beside a wall glowing with orange spores.
1,20250819212756_1,A robot with a rainbow screen face watches a monitor as a cat points.
1,20250819221154_1,"A robotic figure with a screen for a face paddles a raft in a sewer tunnel, accompanied by a cat."
1,20250819224419_1,"A robotic figure sits surrounded by old monitors displaying pixelated faces, candles, and decorations."
1,20250819225943_1,"A robot with a screen displaying a question mark lounges on a couch, wearing a cowboy hat."
1,20250819235843_1,Two humanoid robots and two drones face a cat wearing a harness.
1,20250820144124_1,A group of humanoid robots stands in sunlight outside colorful graffiti-covered walls.
1,20250518135719_1,A man in a red shirt forces a seated man’s mouth open violently.
1,20250523154532_1,Bearded man in red shirt and yellow gloves working outdoors at night with green light.
1,20250523170827_1,A topless woman in a thong stands near a bald man in a dark room.
1,20250523174943_1,Pickup truck and black car driving on a rainy coastal bridge at night.
1,20250526185549_1,Person performing motorcycle wheelie jump against clear sky with power lines and city backdrop.
1,20250526215240_1,Helicopter flying above mountains during dusk with city lights and a crescent moon.
1,20250601134713_1,Car engine engulfed in flames while person with green hair flees in distress.
1,20250602234252_1,Freight train derailed on iron bridge with containers falling and thick black smoke rising.
1,20250603005127_1,"Man on hands and knees in street, blood nearby, people watching from sidewalk."
1,20250605145508_1,Military aircraft flying over dark ocean waves under stormy cloudy night sky.
1,20250605150111_1,Two men in winter clothes aiming pistols at each other in a snowy setting.
1,20250606002006_1,Three women in athletic wear jogging together on a sunlit sidewalk outside a building.
1,20250606003358_1,Large villa-style house with lush landscaping and a person entering the front door.
1,20250606020739_1,"Man in suit pointing handgun, city skyline in background, aggressive caption displayed below."
1,20250606020753_1,"Four men with guns pointed at each other on rooftop, city skyline visible, tense standoff."
1,20250606020949_1,"Man standing on rooftop, holding a sniper rifle and raising fist against blue sky."
1,20250607224007_1,Armed man in tactical gear aiming pistol at another man lying on the ground.
1,20250608000425_1,Two women in lingerie and boots sit on stools in a dimly lit dressing room.
1,20250608011853_1,"Three men stand on cliff at sunset, orange sky reflected on water below."
1,20250608011910_1,Man in bloody white shirt stands near cliff edge at sunset with orange sky.
1,20250608225904_1,Man in black shirt holding red pole stands near large round structure under starry sky.
1,20250608225905_1,Man in dark jacket lies on ground with blood pooling behind his head.
1,20250608225938_1,Man in black shirt holding phone to ear stands outside industrial facility at night.
1,20250608230918_1,"Man in dark shirt aiming a handgun forward, with wrecked bus in background at dusk."
1,20250608231306_1,"A close-up of a man with short hair, wearing a black shirt in a dimly lit warehouse setting."
1,20250608231330_1,"Person engulfed in large flames on ground at night, another figure stands further back."
1,20250614185952_1,"Women in underwear, masks, and hairnets prepare powder and baking soda in lab under bright lights."
1,20250819195810_1,"Three cats stand on green moss and foliage near an edge, with misty blue background."
1,20250819195945_1,A cat lies asleep on the green ground with soft light highlighting its fur.
1,20250819195958_1,A cat sleeps on the grass while a yellow butterfly lands on its back.
1,20250819200637_1,A cat is falling down in a bright outdoor area next to a wall and spikes.
1,20250819200756_1,Dark underground tunnel with bright blue lights illuminating circular mechanical structures and metal pipes.
1,20250819203052_1,A cat is reaching out toward a small robot lying on a patterned rug.
1,20250819223909_1,Several glowing-eyed creatures approach while a cat observes from the side of a metal walkway.
1,20250819225935_1,A cat stands on a reclining robot with a cowboy hat in a cozy room.
1,20250518130027_1,"A person with a camera leans out of a dumpster, reaching toward someone in green."
1,20250523182453_1,"A dirty person in a muddy jumpsuit stands indoors, leaving brown footprints on the carpet."
1,20250602232609_1,"An armored figure stands in a dusty, open area with military obstacles and a setting sun."
1,20250602234903_1,A man in a red shirt stands on a sandy beach beside a rusty car.
1,20250606013551_1,"Two men carry red gas cans inside a dimly lit, cluttered building with peeling walls."
1,20250606014056_1,"A man in a dark jumpsuit stands alone in a small, dimly lit elevator."
1,20250606021556_1,A man in a sleeveless “Del Perro Pier” shirt stands outside beside graffiti wall.
1,20250606114419_1,A man in a suit gives a shirtless person a tattoo on their chest indoors.
1,20250606114425_1,A shirtless man shows off a fresh tattoo while another man stands nearby watching.
1,20250607221037_1,Large tan buildings with palm trees and a sign reading “Richards Majestic” at dusk.
1,20250607222752_1,Cars wait at a night-time intersection with a black limousine in the foreground.
1,20250607224128_1,A man in a blue shirt talks on a phone at an amusement park pier.
1,20250608011134_1,A shirtless man hides in a large black box while another man looks inside.
1,20250608011819_1,Three men stand on a rocky shore watching a calm ocean at sunset.
1,20250608012746_1,A woman with red hair stands inside a cluttered room lit by sunlight through a window.
1,20250608020734_1,A man in a suit stands near a movie poster and champagne bottles in a hallway.
1,20250608225651_1,A man climbs a tall metal ladder next to a large rusty tank at night.
1,20250608225900_1,Two men struggle on a metal catwalk at night surrounded by blue smoke and tanks.
1,20250608231333_1,Two men run away as a huge fireball explosion erupts at night.
1,20250614190015_1,Three armed people walk away from explosions and a crashing jet in a city street.
1,20250819195713_1,Four cats sit in a lush green tunnel with pipes and misty blue light ahead.
1,20250819195752_1,An orange and a black cat sit together on moss near a brown cloth in greenery.
1,20250819195856_1,A black cat stands among leaves in the rain while a pink moon rises above.
1,20250819200433_1,"A small, reddish animal looks at a waterfall cascading down a concrete structure overgrown with vines."
1,20250819200626_1,"A cat stands on a railing, gazing at a waterfall in a green cavern."
1,20250819201624_1,An orange cat sits beside the broken arm of an old robot on a green floor.
1,20250819203518_1,A cat sits inside a bucket suspended by a cable above glowing red fungus.
1,20250819203717_1,"A cat observes two robots outside a brightly lit, graffiti-covered building entrance at night."
1,20250819204059_1,A cat sleeps on a pillow near a robot playing guitar in a cozy room.
1,20250820144109_1,An empty alley with broken car and glowing red-eyed creatures lit by bright sunlight ahead.
1,20250820144329_1,"An orange cat stands atop mossy stone stairs lit by sunlight, surrounded by greenery."
1,20250518134326_1,A shirtless man with clips on his chest sits as another person prepares to spark them.
1,20250518135342_1,"A man aims a rifle while lying on a hill, observing buildings by the ocean."
1,20250518135714_1,A man pulls another man's tooth while he sits restrained with medical pads on chest.
1,20250518135800_1,"A shirtless man, restrained and slumped in a chair, has a syringe in his leg."
1,20250518135817_1,"A shirtless, restrained man with medical pads on chest sits in a dimly lit room."
1,20250518135936_1,"A serious man leans over an injured, shirtless man with blood on his mouth."
1,20250518140529_1,A red pickup truck and a blue Dashound bus stop on a sunlit city street.
1,20250528221238_1,"A surveillance camera view shows a dark lot, targeting a car labeled Franklin Clinton."
1,20250603010802_1,A webpage displays a questionnaire with a selected false answer and a visible URL.
1,20250603020231_1,A helicopter flies through a starry night sky surrounded by dark clouds.
1,20250603023111_1,A black sports car with green underglow is parked beneath an overpass.
1,20250605145440_1,"A small airplane flies at night, silhouetted against cloudy sky above dark mountains."
1,20250605145802_1,A person in a hooded jacket digs with a pickaxe at a snowy grave labeled Michael Townley.
1,20250606020715_1,A man in a suit points a pistol with a city skyline behind him.
1,20250606021503_1,A man in sunglasses and a tank top gestures animatedly toward another man in a suit.
1,20250606021749_1,A black sports car waits at a rainy intersection with a red light and wet roads.
1,20250607225207_1,"A wall is covered with maps, photos, crew files, and a crime planning checklist."
1,20250607232714_1,A sleek black sports car with red underglow is parked outside an auto repair shop.
1,20250608000642_1,"A large yellow tunnel boring machine drills into rock, sending dust and debris flying."
1,20250608011710_1,"Three men look down at the camera, one with a bloodstained white shirt and bruises."
1,20250608011830_1,"A man in a dark jacket stands outside at dusk, mountains and trees in the background."
1,20250608225743_1,"A man in a dark jacket fires a gun at night, sparks fly toward targets."
1,20250614185937_1,"Four classic cars in a showroom with marble walls, one is red and cream."
1,20250614185942_1,"A nightclub with neon dancers, sign reading GEFANGNI, and people watching from below."
1,20250819200306_1,"An orange tabby cat and a white cat stand in a lush, overgrown ruin with water."
1,20250819200638_1,A blurry orange cat jumps down a wall surrounded by greenery and moss.
1,20250819200639_1,"An orange cat sprints quickly down a sloped, overgrown concrete wall covered with plants."
1,20250819200640_1,"An orange cat slides awkwardly down a steep, mossy wall covered with plants and vines."
1,20250819200643_1,"Three cats, a black, a gray, and an orange tabby, stand alert on a leafy ledge."
1,20250819203713_1,An orange cat with a vest stares at a slumped robot on stairs near graffiti.
1,20250819203737_1,"An orange cat with a dark collar sits alone on a cracked street, looking forward."
1,20250819220958_1,"Two robots with lit faces stand in a dim alley, one with cables, one holding a staff."
1,20250819223923_1,A small floating robot with glowing green eyes and antennas hovers in pink light.
1,20250518120903_1,A gloved figure holds a pistol to a man's head in front of a window at sunset.
1,20250526183728_1,A small yellow submersible is suspended over the water by a crane at a port.
1,20250529234849_1,"A jet flies over a city with one engine on fire, trailing black smoke."
1,20250530014416_1,"Two men stand by a dirt road with hills behind, one in a cap and vest."
1,20250601134704_1,"An overturned SUV is on fire at night, flames coming from underneath on a dirt road."
1,20250602232239_1,"Two armored figures observe a police car in the distance, one is holding a large bag."
1,20250602234922_1,"Two men stand on a sandy area, one holding a black briefcase aggressively."
1,20250605144429_1,"Two men sit on a sofa indoors, one in a suit and one in a tank top."
1,20250605145727_1,"A snow-covered gravestone at night reads ""Michael Townley, husband, father, friend, 1965-2004""."
1,20250605150029_1,Two men point guns at each other across a snowy grave at night outdoors.
1,20250606002133_1,A man hangs upside down under a spotlight while two masked figures stand beneath him.
1,20250606005519_1,"Two men hurry beside an RV at sunrise, a car and water tower in background."
1,20250606015424_1,"A tall, metallic, dimly-lit elevator shaft extends upward to a faint light at the top."
1,20250607221049_1,"Three people in business attire have a meeting inside a dimly lit, wood-paneled office."
1,20250607224025_1,A soldier in camo restrains a man on the floor while two women look shocked nearby.
1,20250608001145_1,A masked person in dark clothing grips a metal pole in a dimly lit industrial setting
1,20250608225616_1,"A man is aiming a gun from a walkway, targeting a figure below in a dark industrial setting."
1,20250608225949_1,A man in a dark sweatshirt walks on an empty street talking on a cellphone.
1,20250608230904_1,"A man stands outside at dusk pointing a handgun, with an abandoned bus behind."
1,20250608230907_1,A man in a black shirt aims a handgun with a tense expression outdoors.
1,20250614185936_1,A tall skyscraper surrounded by other modern buildings under a bright blue sky.
1,20250614185941_1,A lively street at night with colorful neon lights and people outside a building.
1,20250614190011_2,A small armored tank is parked on a city street near several cars.
1,20250819195825_1,Two small cats sit together on a mossy ledge beside large rusty pipes.
1,20250819200634_1,An orange cat leaps between two rusty pipes surrounded by green foliage.
1,20250819201628_1,An orange cat sniffs a fallen robot lying on a dirty floor.
1,20250819203403_1,An orange cat rides in a hanging bucket through a dim alleyway.
1,20250819211436_1,A cat stands in a glowing red cave filled with pulsating orbs.
1,20250819223903_1,"A large glowing red eye dominates the scene, with a small robot flying nearby in a surreal, organic environment."
1,20250820144108_1,"A narrow, damaged alley with scattered debris, a small robot, and urban destruction."
1,20250820144113_1,A small robot with a large golden head stands on a balcony in bright sunlight.
1,20250518135501_1,A man in a red shirt is holding a jerrycan above a tied-up person.
1,20250518140026_1,A sniper scope targets a man in a red shirt on a balcony with others nearby.
1,20250518145132_1,An explosion on a cliffside near a small wooden house with a dock.
1,20250529234846_1,A jet airplane labeled AIR EMU has an engine explosion with fire and black smoke.
1,20250530003915_1,"A yellow biplane is flying at night, stars visible above and mountains below."
1,20250602232816_1,A camouflage armored vehicle sits in a busy salvage yard with machinery and industrial buildings.
1,20250606002016_1,Three women jog on the sidewalk while a man stands across the street watching.
1,20250606010453_1,"A person lies injured in the road at night, with a car and motorcycle nearby."
1,20250606014747_1,"Two tall office buildings at night, with explosions and fire at the top floors."
1,20250607224109_1,"A large amusement pier with roller coaster tracks, Ferris wheel, and the DEL PERRO PIER sign."
1,20250607232732_1,A black sports car with red underglow is parked outside an auto repair garage.
1,20250608010600_1,"A man holds a video camera inside a cabin, with another person lying on the floor."
1,20250608011717_1,"A shirtless man with gray hair lies down, bleeding from the neck."
1,20250608225741_1,A man in a black jacket points a handgun at another man at night.
1,20250614190008_2,A werewolf in a red jacket poses in front of large illuminated sign at night.
1,20250819195746_1,A brown cat and black cat lie together on mossy ground surrounded by greenery.
1,20250819195956_1,A brown cat sleeps on the grass while a yellow butterfly rests on its head.
1,20250819200011_1,"Three cats are positioned in an overgrown, abandoned area; two are in shadow, one distant."
1,20250819200017_1,"Two cats play and stretch in shadow, a third cat sits far off in light."
1,20250819200443_1,"A brown cat and black cat stand in an abandoned, overgrown structure filled with greenery."
1,20250819200646_1,"A brown cat with green eyes hangs desperately from a pipe, eyes wide with fear."
1,20250819200655_1,"A brown cat is lying injured and alone in a dark, debris-strewn environment."
1,20250819201040_1,A brown cat walks down a dark alley toward a glowing orange neon sign.
1,20250819203032_1,A small hovering robot with blue lights floats above illuminated floor markings in darkness.
1,20250819203921_1,A weathered building glows with an orange neon sign at night under greenish mist.
1,20250819204116_1,A robot with a TV for a head plays guitar beside a sleeping cat on cushions.
1,20250819205415_1,A cat wearing a small backpack looks through a window at a robot tending plants.
1,20250819205435_1,"A cat with a backpack enters a cozy room, facing a gardening robot in a hat."
1,20250819221001_1,"Two robots embrace warmly, one displays a heart on its screen, in a dark alley."
1,20250820144301_1,A brown cat walks up sunlit overgrown steps as two white birds fly ahead.
1,20250518120826_1,A woman in a blazer and a man in dark shirt lean over a patient together.
1,20250518120852_1,Several people in an office lean over a table during a tense discussion.
1,20250518121406_1,"Two men stand outdoors at sunset, one in casual clothes and one in gear."
1,20250518134325_1,A man in a red shirt holds electric clips near a restrained man.
1,20250518151435_1,A woman in a sleeveless Bishop's shirt talks to a man beside a laptop outside.
1,20250523182434_1,A black-and-white portrait of a woman with glasses in a cracked photo frame.
1,20250530005058_1,A passenger jet flies in the sky while a military jet is closer above a city.
1,20250603015316_1,"A pickup truck drives along a winding road at night under a half-moon, city lights visible."
1,20250605145733_1,A man in a black jacket and jeans holds a shovel while walking through a snowy graveyard.
1,20250606013558_1,"Two men pour gasoline from cans onto the floor of a dimly lit, messy room."
1,20250606020707_1,"Three men with guns confront each other outside at night, another man observes the scene."
1,20250606020810_1,A black helicopter hovers outside a building at night as armed guards and men gather below.
1,20250606113613_1,A large house with ivy-covered walls and lit windows sits next to a pool at night.
1,20250607232918_1,"A black sports car is parked in a lot at sunset, city streets and buildings visible."
1,20250608000416_1,"A neon-lit sign for ""Vanilla Unicorn Gentleman's Club"" is displayed on a dark building exterior."
1,20250608010422_1,A man in a dark polo shirt stands on a balcony at night overlooking city lights.
1,20250608012752_1,A man in a dirty white t-shirt stands in a cluttered room with open closet.
1,20250608225615_1,"A man stands on a metal platform at night, gripping the railing, in a construction site."
1,20250608231253_1,"A man is crawling on the ground by a red jeep, with a large orange tanker behind."
1,20250608231332_1,"A person in a suit flees from an explosion and fire, as another lies on the ground."
