id,images,captions
1,20250614190005_1,A small plane flies close to the water under a city bridge in a concrete channel.
1,20250819195643_1,"Rain falls over an overgrown concrete courtyard with vines and a cloudy, moonlit sky above."
1,20250819195820_1,"Two cats are play-fighting on wet concrete while it rains, plants and moss nearby."
1,20250819200845_1,"A large round metal door in a dimly lit tunnel, surrounded by debris, pipes, and garbage bags."
1,20250819205421_1,"A robot with a monitor head, wearing a straw hat and floral jacket, stands by a computer."
1,20250819225734_1,"A small orange cat with a device on its back walks down a cozy, plant-filled hallway."
1,20250819225742_1,A robot with a glowing face and hat stands near a cat wearing a small backpack.
1,20250819235904_1,"A small cat is trapped in a cage suspended by chains in a dark, green-lit room."
1,20250820144106_1,"A narrow alleyway with scattered junk is lit by sunlight, small red drones move along the ground."
1,20250820144110_1,"A sunlit alleyway with scattered debris, a small vehicle, and no people in sight."
1,20250518140124_1,"Two men exit a metal building by graffiti and a ""Caution Slippery Surface"" sign, outside stairs."
1,20250518145714_1,A large explosion engulfs a small boathouse and pier by a coastline at dusk.
1,20250526183724_1,A small yellow submersible is being lowered into rough sea water near a metal dock.
1,20250601134708_1,A black SUV with its hood on fire is stopped on a dirt road in the forest.
1,20250602234257_1,A person is swimming in a calm lake surrounded by rocky cliffs and green bushes.
1,20250602234259_1,A person swims in a lake as a huge splash and debris erupt from the shore.
1,20250605143838_1,"A man stands on the street with a burning car, firefighters, and a fallen person nearby."
1,20250605151921_1,"A black sports car drives down a multi-lane highway surrounded by hills, other vehicles ahead."
1,20250608011752_1,A black car is parked on rocky terrain with three people and a green motorcycle nearby.
1,20250614185929_1,"A red muscle car drifts at an intersection, leaving tire smoke near a ""Deep Beer"" sign."
1,20250819195755_1,A black cat and an orange cat interact on mossy ground beside pipes and leafy vines.
1,20250819195806_1,"Two cats play on mossy concrete near a large rusty pipe, while another cat walks away."
1,20250819200035_1,"Vines and moss cover concrete walls and pipes under blue sky, with an orange cat climbing."
1,20250819200049_1,"A lush overgrown concrete shaft with thick vines, pipes, and sunlight shining from above."
1,20250819200543_1,Three cats walk along a mossy path surrounded by lush green plants and flowers.
1,20250819202817_1,"A cat sits on top of a bookshelf in a dimly lit, cluttered room with electronics."
1,20250819204724_1,"An orange cat sleeps on a shelf filled with books, pillows, and various objects."
1,20250819225948_1,"A person sits in a reclining chair using a laptop, with a robot displaying a heart nearby."
1,20250819230014_1,"A robot with a heart on its screen sits at a café table, cat nearby."